web-scraper-order,web-scraper-start-url,Event,Event-href,Title,Date and Time,Location,Description,Organizer_link,Organizer_link-href
"1680068986-54","https://www.eventbrite.com/d/ny--new-york/climate-tech/?page=3","VR Tech Summit (3rd Annual)VR Tech Summit (3rd Annual)","https://www.eventbrite.com/e/vr-tech-summit-3rd-annual-tickets-150406187957?aff=ebdssbdestsearch","VR Tech Summit (3rd Annual)","Thursday, September 28 · 10am - 12pm EDT","VIRTUAL EVENT TBA New York, NY 10036","About this event2 hoursMobile eTicketGlobal Startup Ecosystem Announces the 3rd Annual VR Tech Summit in Partnership with Microsoft To accelerate developments within the VR tech industry, the Global Startup Ecosystem (GSE) is to host the 3rd  annual VR Tech Summit- Virtual edition. The VR Tech Summit is the world’s most exclusive event featuring VR tech investors, entrepreneurs and influencers coming together to address the world’s greatest  challenges via VR technology. The summit also serves to teach fundamentals of VR technology, leading applications of VR, and startup development strategies via exclusive workshop sessions with award winning experts. The program concludes with a high profile call to action VIP gathering speakers and partners.This year’s digital summit experience will include A series of keynotes, panels and fireside chats Live Q/A sessions with speakers and sponsors Exhibitor showcase demosCollaboration networking sessions Previous speakers:  Max Noir- Regional Director FXG Tech of America,  Jordan White- Integrated Producer/ Digital Project Manager at Spinifex Group, Alon Grinshpoon- Founder & CEO at echoAR, Blair Neal- Director of Creative Technology at Fake Love6. Einstein Ntim - Partner at Africa Future Fund, Edwin Rogers- NBC News Immersive Media Director,  Alper Guler- CSO at Real (Subsidiary of The Glimpse Group), Cortney Harding- Founder and CEO at Friends with Holograms,  Christine Ntim - Chief Marketing Officer at Global Startup EcosystemFor more information on tickets, sponsorships and partnerships, please email the team at  events@globalstartupecosystem.com .About VR Tech Summit: The VR Tech Summit is the world’s most exclusive event featuring VR tech investors, entrepreneurs and influencers coming together to address the world’s greatest  challenges via VR technology. The summit also serves to teach fundamentals of VR technology, leading applications of VR, and startup development strategies via exclusive workshop sessions with award winning experts. The program concludes with a high profile call to action VIP gathering speakers and partners.VR Tech Summit Media Team(E) events@globalstartupecosystem.com(W) www.vrtechsummit.orgAbout  Global Startup Ecosystem: Global Startup Ecosystem (GSE): is the world’s first digital accelerator and leads today as one of the largest digital ecosystem development platforms. With a mission to educate, inspire and prepare individuals and organizations for the digital age, GSE brings together both private and public stakeholders to address humanity’s greatest challenges via exponential technologies and entrepreneurship. GSE is now the fastest growing tech and business community with an online network that accelerates 1000+ companies a year across 90+ countries and an offline network that supports 75,000+ global delegates a year via its iconic tech summits. This evolving tech community is now a source of tech talent for the remote workforce of the future; accelerating people into the fastest growing tech startups and corporate career networks.(E) events@globalstartupecosystem.com (W) www.globalstartupecosystem.com","Global Startup Ecosystem","https://www.eventbrite.com/o/global-startup-ecosystem-26000946435"
"1680068990-55","https://www.eventbrite.com/d/ny--new-york/climate-tech/?page=3","Creative Climate Awards 2023 - Art Projection onto the Manhattan BridgeCreative Climate Awards 2023 - Art Projection onto the Manhattan Bridge","https://www.eventbrite.com/e/creative-climate-awards-2023-art-projection-onto-the-manhattan-bridge-tickets-558540980107?aff=ebdssbdestsearch","Creative Climate Awards 2023 - Art Projection onto the Manhattan Bridge","The Human Impacts Institute is a non-profit organization that inspires YOU to transform environmental challenges into social action for a just and livable world. We do this through Creative Communication, Learning-By-Doing, and Curated Actions.","Pearl Street Triangle (Dumbo Improvement District) Water Street Brooklyn, NY 11201","About this eventThe Human Impacts Institute invites you to celebrate our annual Creative Climate Awards (CCA) with an Art Projection onto the Manhattan Bridge at the Pearl Street Triangle in partnership with the DUMBO Business Improvement District. E﻿njoy a Saturday night out by the Manhattan Bridge and get inspired by international artists around the world. The Projection showcases artists creating climate-inspired work that raises public awareness and sparks climate action. This event is a part of the Human Impacts Institute's 2023 Creative Climate Awards, a month-long festival of art and ideas that connect us to climate action for a just and liveable world. Join us from April19th - May 12th in NYC. Visit the Human Impacts Institute Creative Climate Awards page to learn more: https://www.humanimpactsinstitute.org/creative-climate-awards Thanks to our partners and sponsors for their support of this year's CCAs: NYC Department of Cultural Affairs & the Taipei Economic and Cultural Office (TECO) in New York Thank you to the DUMBO Business Improvement District for Sponsoring these screenings.Image: Julienne Schaer","Human Impacts Institute","https://www.eventbrite.com/o/human-impacts-institute-10881727595"
"1680068993-56","https://www.eventbrite.com/d/ny--new-york/climate-tech/?page=3","NFT NYC Sex + Tech mixer hosted by Sx NoirNFT NYC Sex + Tech mixer hosted by Sx Noir","https://www.eventbrite.com/e/nft-nyc-sex-tech-mixer-hosted-by-sx-noir-tickets-595976942077?aff=ebdssbdestsearch","NFT NYC Sex + Tech mixer hosted by Sx Noir","Thursday, April 13 · 6 - 11:30pm EDT","251 Bushwick Ave 251 Bushwick Avenue Brooklyn, NY 11206","About this event5 hours 30 minutesMobile eTicketHosted by SX Noir this event will explore NFT culture's intersection with sex and technology. You will also have the opportunity to connect with leaders in the SexTech industry and network with investors, mentors, and more. We will open up the space with a conversation on the future of crypto and nft’s in the sextech space. Followed by a dance party complete with a SexTech performance. We will  have VIP bottle services available. A﻿gendaD﻿oors open 6PMDiscussion begins 7PM- Special guest TBAP﻿reformance 8PMD﻿J 10PMUnderstand that women, marginalized genders and BIPOC will be centered in this conversation and we ask you to be mindful of the space you take up. W﻿ho is Sx Noir? As the founder of Sex Culture Crypto. I aim to create a shame-free safer space to explore our true desires and passions in the rapidly moving space of blockchain technology. SexCultureCrypto will explore what the future of sex, culture, and technology looks like within the crypto and NFTs.My passion for blockchain technology began in 2021 when I realized how crypto and NFTs could revolutionize sextech. I began to be very vocal about sextech in conversations around crypto and NFTs. I see crypto as a solution to the banking discrimination from centralized institutions because of any business related to the sex industry is seen as a VICE interest. We need a new definition of adult businesses and content. I see NFTs as an opportunity to navigate consent within our creative work and the utility of how it will be used to innovate sextech. SexTech has a trust management problem to manage with the current web2 /centralized system I produced, directed, and hosted the first-ever SexTech Crypto event. Every event I host has an ethos of empathy. Sexual freedom cannot be based on the morality of the current Web2 leaders to run and control the current platforms like Facebook. We need to look to Web3 and the decentralization of applications and elimination of censorship to create safer and more welcoming communities. Through these discussions and community, we can collectively break the 4th wall between innovation, compassion, and motivation with industry leaders.","SX NOIR","https://www.eventbrite.com/o/sx-noir-63053888053"
"1680068996-57","https://www.eventbrite.com/d/ny--new-york/climate-tech/?page=3","Climate Town Town HallClimate Town Town Hall","https://www.eventbrite.com/e/climate-town-town-hall-tickets-574683242047?aff=ebdssbdestsearch","Climate Town Town Hall","Starts on Monday, May 8 · 7:30pm EDT. Doors at 7pm","The Bell House 149 7th Street (Between 2nd and 3rd Ave) Brooklyn, NY 11215","About this event1 hour 30 minutesAges 21+Mobile eTicketClimate Town will release a brand new video at this show. We are promising that.But what is Climate Town? Rollie Williams and the Climate Town team make comedy videos about the climate crisis for their 450,000 YouTube subscribers. Now, after two years and millions of views, they're bringing that same climate change comedy to the stage, where you can see it the way it has never before been seen: LIVE. And remember: we will release a brand new video at this show. We are promising that.@climatetown7:00pm Doors / 7:30pm Show$15 GAAges 21+*This event will be mixed seated/standing. Arrive early for best seat selection","The Bell House","https://www.eventbrite.com/o/the-bell-house-17899492469"
"1680068999-58","https://www.eventbrite.com/d/ny--new-york/climate-tech/?page=3","Expo Summit Conference - AI, ML, Big Data, IoT Tech, Cyber-Security, CloudExpo Summit Conference - AI, ML, Big Data, IoT Tech, Cyber-Security, Cloud","https://www.eventbrite.com/e/expo-summit-conference-ai-ml-big-data-iot-tech-cyber-security-cloud-tickets-541976695887?aff=ebdssbdestsearch","Expo Summit Conference - AI, ML, Big Data, IoT Tech, Cyber-Security, Cloud","May 17 · 9am - May 18 · 11pm EDT","726 Broadway 726 Broadway New York, NY 10003","About this event1 day 14 hoursMobile eTicketThe World-Leading AI & Big Data Expo Conference Series will be at Santa Clara Convention Center on the 17-18 May 2023. AI, ML, Big Data Expo Summit North America Global: 17-18 May 2023, Including:AI, ML, Big Data Expo Summit Cloud Congress & Cyber-Security Expo SummitEdge Computing Expo SummitDigital Transformation Week Expo SummitBlockchain& Crypto  Expo SummitIoT Tech Expo Expo SummitThe  North America Global 2023 is a two-day event and conference consisting of top-level content and thought leadership discussions exploring the Edge Computing ecosystem.17-18 May 2023 | Santa Clara Convention Center | California | USAIn a world where speed, connectivity and real time access to data have become a way of life, edge computing has fast become an essential component of virtually every business’s IT strategy. For forward-thinking and dynamic enterprises, edge computing can enable a significant increase in operational efficiency and automation, while dramatically reducing latency.KEY AGENDA TOPICS:The online conference is perfect for those technology professionals making investment and strategy decisions, or building and executing pioneering projects within their organisation.The event will consist of live and on-demand sessions from over 40 speakers sharing their unparalleled industry knowledge and real-life experiences in the forms of solo presentations, expert panel discussions and in-depth fireside chats.Attend the event to learn:* The importance of edge computing as a key pillar in a multi-layered and convergent technology strategy* Business wins enabled by the intelligent edge taken from advanced use cases across multiple industry verticals* Effective partnership models that will optimise edge computing* Using AI to increase the performance of edge devices* Creating best practice roadmaps for cloud-to-edge architecturesThe event  provides insights and strategies for technology decision makers seeking to explore and evaluate thought-leadership topics and valuable strategies to drive businesses forward. Over 5,000 attendees are expected to join this event including CTO’s, Heads of Innovation and Technology, IT Directors, Telecom Providers, Developers, Start-Up’s, Government, Automotive, Operators, Investors, VCs and more.2023 SPEAKERS ANNOUNCED SOON!2022 Speakers Included:* SVP Strategy and Transformation at Wells Fargo* Samani, FRM, Vice President, Software Engineering (AI/ML) at JPMorgan Chase & Co.* Director - Intelligent Connected Systems (ICS) at Toyota* Scientific VP & Fellow, Computational Sciences at The Janssen Pharmaceutical Companies, part of Johnson & Johnson* VP of Product Management, CDN, Cloud Security and Edge Computing at Edgecast* Senior Vice President Bank of America* General Manager at Rakuten Mobile, Inc. Americas* Vice President, Analytics, Clinical Insights and Informatics at Novant Health... and many more!T﻿his event is part of TechEx North America 2023 which consists of 6 co-located events:Blockchain Expo | I﻿oT Tech Expo | A﻿I & Big Data Expo | C﻿yber Security & Cloud Expo | Digital Transformation Week S﻿o you can explore the latest enterprise technology trends and strategies all in one place!AI & Big Data Expo North America 2023 will bring together key industries from across the globe for two days of top-level content and discussion across 5 co-located events covering Blockchain, IoT, 5G, Cyber Security & Cloud, AI and Big data at Santa Clara Convention Center, CA.5,000+ attendees are expected to congregate for the conference including CTO’s, Heads of Innovation and Technology, IT Directors, Developers, Start-Up’s, OEM’s, Government, Automotive, Operators, Technology Providers, Investors, VCs and many more.The AI & Big Data Expo will showcase the most cutting-edge technologies from hundreds of exhibitors and provide insight from over 230+ speakers sharing their unparalleled industry knowledge and real-life experiences.The conference agenda will present a series of expert keynotes, interactive panel discussions and solution-based case studies.All exploring the key industries that are set to be disrupted the most by this new technology, including; legal sectors, retail, financial services, healthcare, insurance, energy, music, government, real estate and more.Artificial Intelligence is transforming and enabling the world to solve problems:Learn what Artificial Intelligence (AI) is by understanding its applications and key concepts, and the developing markets.WHO ATTENDED IN 2022 ? See  image attached belowSearch Keywords: technology, automation, summit, expo, event, networking, start-ups, developers, engineers, machine learning ML, artificial intelligence AI, Silicon Valley, tech, developers, business networking, transform, social business, social networking, event, network, networking, capital, venture capital, amazon, facebook, meta, intel, banks, asset managers, hedge funds, banks, writers, media, social media, apple, google, alphabet, intuit, Tesla, Tesla, oracle, riven, roche, adobe, data, data engineering, technology, salesforce, conference, summit, expo, energy low carbon, events, sillicon valley, startup , venture capital, ventures","Expo Summit Global","https://www.eventbrite.com/o/expo-summit-global-60601581233"
"1680069002-59","https://www.eventbrite.com/d/ny--new-york/climate-tech/?page=3","Long Beach NY - Tech FairLong Beach NY - Tech Fair","https://www.eventbrite.com/e/long-beach-ny-tech-fair-tickets-597409627277?aff=ebdssbdestsearch","Long Beach NY - Tech Fair","Saturday, April 1 · 11am - 3pm EDT","615 Riverside Blvd 615 Riverside Boulevard Long Beach, NY 11561","About this event4 hoursMobile eTicketWelcome to the Long Beach Teach Fair This event is the perfect opportunity for anyone who is interested in the latest advancements in robotics, artificial intelligence, social media, virtual reality, and other emerging technologies. If you want to stay ahead of the curve and be at the forefront of innovation, then this is an event you can't afford to miss.At this expo, you'll get the chance to interact with cutting-edge technologies that are poised to revolutionize the way we live, work, and play. You'll have the opportunity to see the latest robots in action, experience virtual reality firsthand, and discover how AI is transforming industries from healthcare to finance.In addition to showcasing amazing tech, the expo will also feature a series of expert-led talks and panel discussions. You'll hear from industry leaders, academics, and researchers about the future of these technologies and the impact they're likely to have on society.But this event is not just for tech enthusiasts and industry professionals. Anyone who is curious about the future and wants to be part of the conversation should attend. Emerging technologies are shaping the world we live in, and it's important for everyone to understand their potential and their limitations.So come join us at the Long Beach NY Tech Fair and be part of the future. Whether you're a student, a business owner, or just someone who loves to learn, there's something for everyone at this event. Don't miss out on the chance to see the future today!PANEL AND KEYNOTES SPEAKERSKevin White - Information technology specialists at SOFI BankDiana Rose - Founder of Sovereign Markets, LLCNathan Coy - Founder of Wartime Leadership, LLCPaul Aloo - Founder of Success Draft, LLCFREE DRINKS AND FOOD WILL BE OFFEREDAgendaTech CareerLeadershipPanel Speakers11:40 AM - 12:10 PM How to leverage your career with technologyKevin White","Glorious Destiny Missions, Inc.","https://www.eventbrite.com/o/glorious-destiny-missions-inc-50150713693"
"1680069006-60","https://www.eventbrite.com/d/ny--new-york/climate-tech/?page=3","Big Red Ventures Annual MeetingBig Red Ventures Annual Meeting","https://www.eventbrite.com/e/big-red-ventures-annual-meeting-tickets-515200357137?aff=ebdssbdestsearch","Big Red Ventures Annual Meeting","Thursday, April 20 · 5:30 - 8:30pm EDT","Cornell Tech: Verizon Executive Education Center 2 West Loop Rd New York, NY 10044","About this event3 hoursMobile eTicketYou’re invited to join Big Red Ventures, Cornell’s MBA-run early-stage venture capital fund, for the 2023 Annual Meeting on Thursday, April 20 from 5:30-8:30 p.m. at Cornell Tech's Verizon Executive Education Center in New York City. The event will feature a keynote speaker, an introduction into the BRV portfolio companies, a chance to meet both the class of '23 and class of '24 fund manager teams, and the opportunity to network with active Cornell alumni in the startup and venture ecosystem. Portfolio company presentations will be followed by networking over appetizers and beverages.General admission tickets for the event are $40. Ticket includes access to networking, content, appetizers, and a light bar.A﻿bout Big Red Ventures:Big Red Ventures is Cornell University's student run venture capital fund.Big Red Venture Fund (BRV) is an early-stage venture capital fund operated entirely by a team of MBA students at Cornell University’s Johnson Graduate School of Management. Founded in 2001, BRV is one of the the oldest student-run venture funds. BRV typically invests up to $25,000 in U.S.-based, high-growth companies across all industries. Initially funded by donations to Cornell University, BRV is a true evergreen fund, recycling all proceeds for reinvestment. Along with investing start-up capital in promising new companies, BRV also serves as the gateway to Cornell technologies by providing its investment partners unique access to new innovations.A﻿ccessibility:Please contact Hope Spithaler (hbs63@cornell.edu) at least five days prior to the event with any accessibility needs. A﻿greement:By registering for this event, you acknowledge and agree to our Privacy Policy and Terms & Conditions. C﻿ontact:Q﻿uestions?  Contact board@brventurefund.com.","Big Red Ventures","https://www.eventbrite.com/o/big-red-ventures-32770354899"
"1680069009-61","https://www.eventbrite.com/d/ny--new-york/climate-tech/?page=3","New York City FoodHack meetup - Fungi ForumNew York City FoodHack meetup - Fungi Forum","https://www.eventbrite.com/e/new-york-city-foodhack-meetup-fungi-forum-tickets-425574373407?aff=ebdssbdestsearch","New York City FoodHack meetup - Fungi Forum","Wednesday, March 29 · 6:30 - 9:30pm EDT","Newlab 19 Morris Avenue Brooklyn, NY 11205","About this event3 hoursMobile eTicketAbout this EventJ﻿oin Fungi Forum, the second FoodHack Meetup in New York City, in collaboration with Newlab. FoodHack meetups for food tech entrepreneurs, investors and food enthusiasts to network and hear from food industry speakers. Whether you're growing your food business, looking to connect with startups to invest in or want to network with other like-minded professionals - this event is for you.Date : Wednesday March 29thTime: 6:30 PMVenue: Newlab, Brooklyn Navy Yard, 19 Morris Ave, Brooklyn, NY 11205, United StatesLanguage : EnglishA﻿genda: Introductions from FoodHack NYC and NewlabPanel and Q&AFood from our incredible partners and networking Pitch:  Are you launching a new product? Are you looking for your next R&D expert or your next CEO? Are you looking for a job or an internship? Join our 30-second pitch session and share your business update with the audience (open to anyone). The FoodHack Meetup concept:Global food industry meetups to network, learn and get inspired. Always free to attend and open to everyoneIndustry guest speakers speaking and answering questions from the audienceOpportunity to pitch your business, venture, etc. on stageAbout the Organizer:FoodHack is a global community for FoodTech founders and Funders. We inspire, highlight and help fund Foodtech founders. A﻿bout the Host:Newlab is a center of invention applying innovation to some of the world’s most complex challenges in mobility, energy, and materials. The heart of Newlab is its community of inventors, engineers, scientists and entrepreneurs collaborating with partners across industries and sectors. Newlab pairs these solvers with challenges and fosters a culture of relentless incrementalism applied to real-world problems to build, test and scale world-changing solutions.   T﻿his event is free but registration is mandatory. Please let us know if you can't attend so we can release your ticket for someone else. Thank you!","FoodHack","https://www.eventbrite.com/o/foodhack-13624342445"
"1680069015-62","https://www.eventbrite.com/d/ny--new-york/climate-tech/?page=2","City of Science: Climate Change and HealthCity of Science: Climate Change and Health","https://www.eventbrite.com/e/city-of-science-climate-change-and-health-tickets-528045577537?aff=ebdssbdestsearch","City of Science: Climate Change and Health","Wednesday, May 10 · 6:30 - 7:45pm EDT","The Skylight Room, The Graduate Center 365 5th Avenue 9th Floor New York, NY 10016","About this event1 hour 15 minutesMobile eTicketClimate change increasingly affects many areas of our lives, but little attention is paid to how it is affecting our health. Research shows the significant impact of climate change on childbearing, nutrition, stress, and our overall physical and mental wellbeing. Find out why, and what can be done about specific threats to public health, from group of leading scientists from CUNY. Featuring: Reginald Blake, professor of Earth and Environmental Sciences at the CUNY Graduate Center and New York City College of Technology;  Patrizia Cassacia, Einstein professor of biology and biochemistry and director of the Neuroscience Initiative at the Advanced Science Research Center, CUNY Graduate Center; Hamid Norouzi, a professor in the Department of Construction Management and Civil Engineering Technology at New York City College of Technology and in the Earth and Environmental Sciences program at the CUNY Graduate Center; and Yoko Numura, professor of psychology at Queens College and the CUNY Graduate Center and associate clinical professor at the Icahn School of Medicine, Mount Sinai.","GC Public Programs","https://www.eventbrite.com/o/gc-public-programs-12425664023"
