web-scraper-order,web-scraper-start-url,Event,Event-href,Title,Date and Time,Location,Description,Organizer_link,Organizer_link-href
"1680069061-76","https://www.eventbrite.com/d/ny--new-york/climate-tech/?page=2","Diverse Women: Breaking into TechDiverse Women: Breaking into Tech","https://www.eventbrite.com/e/diverse-women-breaking-into-tech-tickets-595214591867?aff=ebdssbdestsearch","Diverse Women: Breaking into Tech","Wednesday, April 26 · 4:30 - 7:30pm EDT","Alianza Dominicana Cultural Center 530 W 166th St New York, NY 10032","About this event3 hoursMobile eTicketWondering how to enter and make it in technology?There are many opportunities for working in technology and using it to foster change. You don’t have to have a STEM background or know how to code. If your core business is not in technology, you can still learn how to engage with technology-related fields and activities. If you have a tech business, learn different ways to scale.This event will help you embrace the possibilities. Meet and network face-to-face with founders of tech businesses, women in corporations and entrepreneurs. Join round-table conversations to explore multiple facets of the technology business.The webinar and networking are free.		R﻿SVP now to reserve your spot! What you will learn:By the end of this event, you will be able to:Identify opportunities for engaging in technology-related fields and activitiesUnderstand how tech companies can scaleChart paths for your business to grow with the technology sectorAGENDAPanel DiscussionsListen to two panels of women – three who work in major technology companies like Google and three founders of innovative small technology businesses such as Moodbit and others discuss opportunities to join, create, or engage with them.NetworkingThere will be opportunity after the panel discussions for networking with panel speakers and other women.One-on-One MentoringSCORE NYC mentors with expertise in marketing, business planning, finance and other areas will be there to meet you after the panel discussion. Sessions are free, one-on-one and confidential.Refreshments will be available until they run out.Donations of $10 or more to NYWIB are welcome and appreciated, but not required.CLICK here if you would like to donate to support NYWIB’s mission and programs.REGISTER NOWYou will get the link to the event in your confirmation email after you register.*Disclaimers: (1) This event is open to the public and at no-cost, doors will be closed once the venue reaches capacity, arrive early. (2) By signing up for this event you accept to be photographed and recorded, and allow women.nyc to use the materials for informational and promotional purposes.(3) By registering to this event you accept to join our email list and receive information about future events and resources. (4) Food and drinks are provided until supplies last, and you decline to make the organizers responsible for any allergies or reactions the food could cause you.About women.nycWomen.nyc - part of the New York City Economic Development Corporation - is an innovative program created to make NYC the best place in the world for women of all backgrounds, ages, abilities and identities to thrive in their careers, run businesses and launch startups.Bookmark women.nyc to stay engaged in this program. We will have a series of events centered around these high-priority sectors, allowing you to sign up for career coaching and shadowing. This is the only women-centric network established to help you take control of your future.About WE NYC WE NYC (Women Entrepreneurs NYC) is an initiative based out of the New York City Department of Small Business Services that is dedicated to helping women start and grow their businesses. Free services are available for women entrepreneurs across the five boroughs and in multiple languages. This event is co-managed by the WE Connect portfolio of WE NYC, run by 3x3, an inclusive innovation agency based in Brooklyn. WE Connect offers guidance to women entrepreneurs seeking to launch new ideas and increase business by connecting them with the right resources.About NYWIBAbout Catholic Charities","women.nyc","https://www.eventbrite.com/o/womennyc-42945034563"
"1680069064-77","https://www.eventbrite.com/d/ny--new-york/climate-tech/?page=2","Navigating the Tech WorkspaceNavigating the Tech Workspace","https://www.eventbrite.com/e/navigating-the-tech-workspace-tickets-568215877987?aff=ebdssbdestsearch","Navigating the Tech Workspace","Thursday, April 6 · 12:30 - 3pm EDT","NYU Midtown Center 20 W 43rd St. Room 421 New York, NY 10036","About this event2 hours 30 minutesMobile eTicketJoin us for an exciting and engaging panel discussion as we explore the dynamic and ever-evolving world of technology. Our expert panelists will dive deep into the latest trends in the tech industry, including the most innovative AI tools that are revolutionizing the way we work and interact with technology.In addition, we'll also be discussing best practices for workplace communication, which is critical for success in any industry, especially in the tech space. Whether you're a seasoned tech professional or just starting out in your career, you won't want to miss this opportunity to learn from the best and brightest in the field.So come join us for a thought-provoking discussion, where you'll have the chance to engage with our panelists, ask questions, and gain valuable insights that will help you stay ahead of the curve in this rapidly changing field.T﻿he session is held in person (with limited seating) and has a virtual option for attendance, as well. AgendaTech Panel & DiscussionRoom 4211:45 PMNetworkingRoom 421","NYU SPS Management & Technology","https://www.eventbrite.com/o/nyu-sps-management-amp-technology-61693431053"
"1680069067-78","https://www.eventbrite.com/d/ny--new-york/climate-tech/?page=2","Regulating Big Tech: Lessons from Around the WorldRegulating Big Tech: Lessons from Around the World","https://www.eventbrite.com/e/regulating-big-tech-lessons-from-around-the-world-tickets-556459845377?aff=ebdssbdestsearch","Regulating Big Tech: Lessons from Around the World","Thursday, March 30 · 5 - 6:30pm EDT","School of International and Public Affairs International Affairs Building, 420 West 118th Street Room 1501 New York, NY 10027","About this event1 hour 30 minutesMobile eTicketThis conversation, co-sponsored by SIPA’s Technology Media and Communications specialization and Columbia World Projects, will lay the foundation for the 2023 Niejelow-Rodin Global Digital Futures Policy Forum to consider new regulatory models for digital platforms in regions beyond the United States and Europe. The Digital Giants have become a source of global concern, both because of their market power and the “digital harms” to which they give rise. Yet regulation is not easy: democracies worry about the abridgment of free speech; while these Digital Giants are global, standards, market effects, and values are national and local. Are they too big, too complex, and too dynamic to regulate, with any such attempts threatening innovation? While the United States has yet to introduce new laws, Europe, Australia and China have forged ahead, with quite different models. The conversation will discuss  the Center on Regulation in Europe’s (CERRE) report on prospects and frameworks for tech regulation and consider  the global applicability of a broadened version of that framework.  Moderator: Merit Janow, Professor of Professional Practice in International Economic Law and International Affairs in the School of International and Public Affairs; Dean Emerita of the Faculty of International and Public AffairsPanelists:Rod Sims, Professor of Public Policy, Australian National University; Former Chair, Australian Competition and Consumer Commission (ACCC)Joseph E. Stiglitz, University Professor, Columbia UniversityBruno Liebhaberg, Founder and Director General, Centre on Regulation in Europe (CERRE)Eleanor Fox, Walter J. Derenberg Professor of Trade Regulation Emerita, New York University School of Law","Technology, Media and Communications, Columbia SIPA","https://www.eventbrite.com/o/technology-media-and-communications-columbia-sipa-55976510793"
"1680069071-79","https://www.eventbrite.com/d/ny--new-york/climate-tech/?page=2","June 5th - NY's  Biggest Business, Tech & Entrepreneur Networking AffairJune 5th - NY's  Biggest Business, Tech & Entrepreneur Networking Affair","https://www.eventbrite.com/e/june-5th-nys-biggest-business-tech-entrepreneur-networking-affair-tickets-573345169837?aff=ebdssbdestsearch","June 5th - NY's  Biggest Business, Tech & Entrepreneur Networking Affair","Monday, June 5 · 6:30 - 8:30pm EDT","Monarch Rooftop 71 W 35th St New York, NY 10001","About this event2 hoursMobile eTicket MAKE SURE TO RSVP. **FREE GIFT WITH CONFIRMED RSVP AT THE EVENT**  ***TO ATTEND BUT RSVP MUST*** List of Future Events This is the largest networking mixer for Entrepreneurs , Startups and Business Professionals In New York.   Calling All: Tech Startups ! Entrepreneurs !  Owners ! Professionals ! Free-lancers, policy-makers, game-changers, and heroes! Starting Summer 2023 with NY's Best Professional Networking Affair. Please join us for an evening of creativity, inspiration and passionate conversations.Join & raise a glass - make connections with co-founders, partners, coaches or core team members for your start-up- meet fellow professionals and mingle with makers of great and big ideas - take home treats from growing community and some business cards.Hosted By - New York Entrepreneurs, Startup & Business Coalition.Ambiance:- Name Tags will be provided to everyone who attends. We request you put your name and industry on your name tag.- Make sure you bring enough business cards.- The dress code is Business Casual.Timings:- Event is from 6:30 PM to 8:30 PM..***Arriving on time recommended.  Admission: Must RSVP.  Drinks Policy: One drink minimum (mandatory), it will help support the venue as they are holding space for us. ***Since this is a drinking establishment, all attendees must be 21+.***  For Sponsorship & Business Queries EmailMoveyourcareer@gmail.comwww.professionalunite.comYour chance to meet new clients and generate more business.•	Do you know that Nearly 100% of people say that face-to-face meetings are essential for long-term business relationships.•	Do you know 92% of people trust personal recommendations more than any other form of marketing.•	Do you want to grow your business.•	Do you want to build long-lasting, strong relationships within a diverse group of professionals.THEN YOU SHOULD ATTEND THIS EVENT.Hosted By - New York Entrepreneurs, Startup & Business Coalition.Facebook Page -  NYESNFacebook Group- NYCESNMeetup Group - MEETUPInstagram Link - professionalunite Youtube Channel - Youtube DRESS CODE: Business casual wear or upscale trendy. Athletic wear and sneakers will not be allowed. PROOF OF AGE:  Government issued ID for proof of 21+ for entry. COVID-19 POLICY: Still recommended not Mandatory. With the current NYC directive, all guests should try to (not mandatory) to show proof of vaccine* with a matching valid ID upon entry.","New York Entrepreneurs, Startup & Business Coalition","https://www.eventbrite.com/o/new-york-entrepreneurs-startup-amp-business-coalition-9879419208"
"1680069074-80","https://www.eventbrite.com/d/ny--new-york/climate-tech/?page=2","April Lady Tech Guild MeetingApril Lady Tech Guild Meeting","https://www.eventbrite.com/e/april-lady-tech-guild-meeting-tickets-576502322967?aff=ebdssbdestsearch","April Lady Tech Guild Meeting","Wednesday, April 5 · 7 - 10pm EDT","ONX Studio 645 5th Avenue Lower Level, NY 10022","About this event3 hoursMobile eTicketJoin us for our April Lady Tech Guild Meeting! This month we are hosting a motion capture tech demo by LaJuné McMillian at ONX Studio. No prior experience needed! Please join us for networking, drinks, and snacks. ONX is interested in supporting women in tech and is excited to open its doors to the Lady Tech Guild!We can't wait to see you!About LaJuné:LaJuné is a Multidisciplinary Artist, and Educator creating art that integrates performance, extended reality, and physical computing to question our current forms of communication. They are passionate about discovering, learning, manifesting, and stewarding spaces for liberated Black Realities and the Black Imagination. LaJune believes in making by diving into, navigating, critiquing, and breaking systems and technologies that uphold systemic injustices to decommodify our bodies, undo our indoctrination, and make room for different ways of being.LaJuné has had the opportunity to show and speak about their work at Pioneer Works, National Sawdust, Leaders in Software and Art, Creative Tech Week, and Art & Code's Weird Reality. LaJuné was previously the Director of Skating at Figure Skating in Harlem, where they integrated STEAM and Figure Skating to teach girls of color about movement and technology. They have continued their research on Blackness, movement, and technology during residencies and fellowships at the Jerome Hill Artist Fellowship, Eyebeam, Pioneer Works, Barbarian Group, and Barnard College.About ONX Studio:ONX Studio is a hybrid production and exhibition space with a global community of members who create interactive and immersive XR works. Located in the Onassis Gallery in Midtown Manhattan, it was founded in partnership by the Onassis Foundation and New Museum’s NEW INC.","Lady Tech Guild","https://www.eventbrite.com/o/lady-tech-guild-62084449153"
"1680069077-81","https://www.eventbrite.com/d/ny--new-york/climate-tech/?page=2","Starta Spring 2023 Pitch ContestsStarta Spring 2023 Pitch Contests","https://www.eventbrite.com/e/starta-spring-2023-pitch-contests-tickets-577543607477?aff=ebdssbdestsearch","Starta Spring 2023 Pitch Contests","Headquartered in New York City, USA, Starta Ventures, unites under its brand an early-stage investment fund, acceleration program, and co-working space. Starta’s mission is to break through traditional venture capital barriers to empower the next generation of tech entrepreneurs.","220 E 23rd St 220 East 23rd Street Suite 400 New York, NY 10010","About this eventStarta Accelerator cordially invites you to our Spring 2023 Pitch Contests in NYC!Schedule:6﻿:00 - 6:30 PM - Doors Open6:30 - 8:00 PM - Founders' Pitches, Q&A8:00 - 9:00 PM - Happy Hour & NetworkingWatch as founders hone their startups' pitch in front of a panel of judges, consisting of VCs, angels and industry experts.After the presentations, we will have a Q&A. Then, you can network with other frontrunners, entrepreneurs and investors of the NYC startup scene.Refreshments served.Starta is a venture ecosystem that finds, fosters, and funds early-stage talent in tech.Our mission is to provide opportunities to:International startups who want to scale globally and raise capitalAspiring industry leaders, seeking professional trainingInvestors who believe in long-term growth potential and strong community connectionsIf you need a promo code, please reach out to fc@starta.vcH﻿ere are our cohort startups:amolingua.comatomian.combiomma.com.cocybionyx.comdairus.comdoktorconnect.comedekee.comfandy.mekindlink.comodworks.comoneapp.lyorderspark.compakam.ngpayhaus.apppfms.cmtravelbayonline.comusairsupply.comwallx.co","Starta","https://www.eventbrite.com/o/starta-17792910582"
"1680069084-82","https://www.eventbrite.com/d/ny--new-york/climate-tech/?page=1","Ai Tech Summit (4th Annual)Ai Tech Summit (4th Annual)","https://www.eventbrite.com/e/ai-tech-summit-4th-annual-tickets-150406135801?aff=ebdssbdestsearch","Ai Tech Summit (4th Annual)","Wednesday, September 27 · 10am - 12pm EDT","Location TBA TBA New York, NY 10036","About this event2 hoursMobile eTicketGlobal Startup Ecosystem Announces the 3rd Annual Ai Tech Summit in Partnership with Microsoft To accelerate developments within the artificial intelligence and robotics industry, the Global Startup Ecosystem will be hosting the 4th annual Ai Tech Summit . The Ai Tech Summit is the world’s most exclusive event featuring Ai tech investors, entrepreneurs and influencers coming together to address the world’s greatest  challenges via Ai technology. The summit also serves to teach fundamentals of Ai technology, leading applications of Ai, and startup development strategies via exclusive workshop sessions with award winning experts. Previous speakers include Alex Poon- COO & Founder at X.ai, Meg Columbia-Walsh Women In IT 2018 Entrepreneur of the Year, Mina Salib Program Director, Catalyst Program at Future Labs at NYU Tandon School of Engineering,, Kate Bradley Chernis Founder & CEO of Lately and Paul Levy Chief Chatbot Officer at ArtificialChat Inc.This year’s digital summit experience will include A series of keynotes, panels and fireside chats Live Q/A sessions with speakers and sponsors Exhibitor showcase demosCollaboration networking sessions For more information on tickets, sponsorships and partnerships, please email the team at  events@globalstartupecosystem.com .About Ai Tech Summit:  Ai Tech Summit is the world’s most exclusive event featuring Ai tech investors, entrepreneurs and influencers coming together to address the world’s greatest  challenges via Ai technology. The summit also serves to teach fundamentals of Ai technology, leading applications of Ai, and startup development strategies via exclusive workshop sessions with award winning experts. The program concludes with a high profile call to action VIP gathering speakers and partners.Ai Tech Summit Media Team(E)  events@globalstartupecosystem.com .(W) www.Aitechsummit.orgAbout  Global Startup Ecosystem: Global Startup Ecosystem (GSE): is the world’s first digital accelerator and leads today as one of the largest digital ecosystem development platforms. With a mission to educate, inspire and prepare individuals and organizations for the digital age, GSE brings together both private and public stakeholders to address humanity’s greatest challenges via exponential technologies and entrepreneurship. GSE is now the fastest growing tech and business community with an online network that accelerates 1000+ companies a year across 90+ countries and an offline network that supports 75,000+ global delegates a year via its iconic tech summits. This evolving tech community is now a source of tech talent for the remote workforce of the future; accelerating people into the fastest growing tech startups and corporate career networks.(E) events@globalstartupecosystem.com (W) www.globalstartupecosystem.com Apply to Startup Lab via https://forms.gle/WtXZCH3tedz9Prq28","Global Startup Ecosystem","https://www.eventbrite.com/o/global-startup-ecosystem-26000946435"
"1680069088-83","https://www.eventbrite.com/d/ny--new-york/climate-tech/?page=1","Japanese Creativity in the Great Tech Race: Beneficiary or Victim?Japanese Creativity in the Great Tech Race: Beneficiary or Victim?","https://www.eventbrite.com/e/japanese-creativity-in-the-great-tech-race-beneficiary-or-victim-tickets-514403844747?aff=ebdssbdestsearch","Japanese Creativity in the Great Tech Race: Beneficiary or Victim?","Tuesday, April 11 · 12:30 - 1:30pm EDT","Room 640, Geffen Hall, Columbia Business School 645 West 130th Street New York, NY 10027","About this event1 hourMobile eTicketI﻿mportant Note: Registration for the main event room is now closed. You may register to watch the event from an overflow room providing the live feed of the seminar. The overflow room is Room 540, Geffen Hall, Columbia Business School. Japanese Creativity in the Great Tech Race: Beneficiary or Victim? Tuesday, April 11, 2023 | 12:30 – 1:30 PM (Lunch will be provided)Room 640, Geffen Hall, Columbia Business School (Map)(645 West 130th Street, New York, NY 10027)Featuring:Kyoko Matsushita CEO, WPP in JapanModerator:David E. Weinstein Director, CJEB; Carl S. Shoup Professor of the Japanese Economy, Columbia UniversityTopics to be covered: •	Japan’s adland: As the world’s third-largest advertising market, what is the state of Japan’s industry? What are the challenges and opportunities vs. other global markets? What tools and practices should marketers in Japan be adopting, and how do they stand to benefit from these? Can WPP deliver on these? •	Global technological development and the need to remain humanely creative: With the rise of new AI tools like ChatGPT, the evolution of Virtual Idols and the Metaverse, some say that creatives stand to lose their jobs, or that at the very least, their jobs will look different. What risks do these tools bring? How do these tools impact personalization? Is that something we are moving towards or away from in advertising? Ms. Matsushita will share her perspective.•	Repercussions for Japan’s creative industry: Are these tools the solution Japanese marketers need to catch up and digitalize? Are they input or output tools? Is there a need for human creatives anymore? How can these new tools be used creatively to benefit wider society in Japan and across the globe?   About the speaker:Kyoko Matsushita assumed her role as Chief Executive Officer of WPP in Japan in April 2022 to oversee its agencies in Japan ― AKQA, BCW, Geometry Ogilvy, Grey, GroupM, Hogarth, Landor & Fitch, VMLY&R, and Wunderman Thompson ― and strengthen collective capabilities of the entire group. Prior to her current appointment, she served as Global CEO of Essence, WPP’s data science-driven digital media agency. She led and oversaw business to achieve the agency’s global growth, culture, and innovation, as well as ensuring that Essence delivers on its mission to make brands more valuable to customers. She joined Essence in 2014 as CEO for Asia Pacific to facilitate rapid expansion and established its presence in the region. She also served as the first Global Chief Client Officer of the agency, leading the Client Service practice, client satisfaction and both organic and new business growth. A client-centric leader with a passion for growing companies and helping people, she was appointed Global CEO in 2019 to oversee 23 offices across 12 countries.Recognized by The Drum as one of the world's leading digital marketers and by Campaign as one of APAC's leading CEOs, Kyoko has held global and regional roles overseeing media, marketing, product development and operations for over two decades. Before joining Essence, she was Vice President of GREE, a leading mobile gaming company where she scaled international operations. She also headed marketing communication at Sony Europe and led marketing for online games at Electronic Arts for both EMEA and APAC. Previously, she served as a global business director at Leo Burnett and Starcom from the agencies’ Chicago, Frankfurt, and Tokyo offices.Kyoko earned a Master of Science degree from the London School of Economics and Political Science. Based in San Francisco with her husband and two children, she enjoys hiking, practicing Aikido, and volunteering as a game tester for educational apps in her spare time.Admission and Contact: You must register to attend this in-person-only event.If you have questions about the event, please contact us at cjeb@gsb.columbia.edu. Special Notes:● Advance registration is required to attend this event. ● This in-person-only event is open to the public and will not be live streamed. Please note registration does not guarantee a seat.● Please be advised that this event may be photographed, so your image may appear on our website or in CJEB materials later. If this is an issue, please let us know.● Please note that due to current University guidelines in response to the COVID-19 pandemic, all visitors must have their primary series of COVID-19 vaccination and be prepared to show proof if asked.﻿For more information about other CJEB events, visit our website or contact cjeb@gsb.columbia.edu.","Center on Japanese Economy and Business","https://www.eventbrite.com/o/center-on-japanese-economy-and-business-17803856672"
